{
  "$defs": {
    "marketBar": {
      "additionalProperties": false,
      "properties": {
        "close": {
          "$ref": "#/$defs/nullableNumber"
        },
        "completed": {
          "type": [
            "boolean",
            "null"
          ]
        },
        "ema_fast": {
          "$ref": "#/$defs/nullableNumber"
        },
        "ema_slow": {
          "$ref": "#/$defs/nullableNumber"
        },
        "ended_at": {
          "type": [
            "string",
            "null"
          ]
        },
        "interval_minutes": {
          "type": [
            "integer",
            "null"
          ]
        },
        "received_at": {
          "type": [
            "string",
            "null"
          ]
        },
        "source_updated_at": {
          "type": [
            "string",
            "null"
          ]
        },
        "started_at": {
          "type": [
            "string",
            "null"
          ]
        },
        "symbol": {
          "type": "string"
        },
        "vwap": {
          "$ref": "#/$defs/nullableNumber"
        }
      },
      "required": [
        "symbol",
        "close",
        "vwap",
        "ema_fast",
        "ema_slow",
        "interval_minutes",
        "started_at",
        "ended_at",
        "source_updated_at",
        "received_at",
        "completed"
      ],
      "type": "object"
    },
    "nullableNumber": {
      "type": [
        "string",
        "number",
        "null"
      ]
    }
  },
  "$schema": "https://json-schema.org/draft/2020-12/schema",
  "additionalProperties": false,
  "properties": {
    "account": {
      "additionalProperties": false,
      "properties": {
        "account_type": {
          "type": [
            "string",
            "null"
          ]
        },
        "buying_power": {
          "type": [
            "string",
            "number",
            "null"
          ]
        },
        "consecutive_losses": {
          "minimum": 0,
          "type": [
            "integer",
            "null"
          ]
        },
        "entries_today": {
          "minimum": 0,
          "type": [
            "integer",
            "null"
          ]
        },
        "equity": {
          "type": [
            "string",
            "number",
            "null"
          ]
        },
        "equity_position_count": {
          "minimum": 0,
          "type": [
            "integer",
            "null"
          ]
        },
        "open_equity_order_count": {
          "minimum": 0,
          "type": [
            "integer",
            "null"
          ]
        },
        "open_option_order_count": {
          "minimum": 0,
          "type": [
            "integer",
            "null"
          ]
        },
        "option_position_count": {
          "minimum": 0,
          "type": [
            "integer",
            "null"
          ]
        },
        "reserved_cash": {
          "$ref": "#/$defs/nullableNumber"
        },
        "settled_cash": {
          "$ref": "#/$defs/nullableNumber"
        },
        "unsettled_cash": {
          "$ref": "#/$defs/nullableNumber"
        }
      },
      "required": [
        "account_type",
        "equity",
        "buying_power",
        "option_position_count",
        "equity_position_count",
        "open_option_order_count",
        "open_equity_order_count",
        "consecutive_losses",
        "entries_today",
        "settled_cash",
        "unsettled_cash",
        "reserved_cash"
      ],
      "type": "object"
    },
    "completed_live_trades": {
      "minimum": 0,
      "type": [
        "integer",
        "null"
      ]
    },
    "market": {
      "additionalProperties": false,
      "properties": {
        "market_open": {
          "type": [
            "boolean",
            "null"
          ]
        },
        "near_forced_exit": {
          "type": [
            "boolean",
            "null"
          ]
        },
        "within_entry_window": {
          "type": [
            "boolean",
            "null"
          ]
        }
      },
      "required": [
        "market_open",
        "within_entry_window",
        "near_forced_exit"
      ],
      "type": "object"
    },
    "market_bars": {
      "items": {
        "$ref": "#/$defs/marketBar"
      },
      "minItems": 4,
      "type": "array"
    },
    "option": {
      "additionalProperties": false,
      "properties": {
        "ask": {
          "$ref": "#/$defs/nullableNumber"
        },
        "bid": {
          "$ref": "#/$defs/nullableNumber"
        },
        "delta": {
          "$ref": "#/$defs/nullableNumber"
        },
        "earnings_date": {
          "type": [
            "string",
            "null"
          ]
        },
        "expiration": {
          "type": [
            "string",
            "null"
          ]
        },
        "instrument_id": {
          "minLength": 1,
          "type": "string"
        },
        "open_interest": {
          "minimum": 0,
          "type": [
            "integer",
            "null"
          ]
        },
        "option_type": {
          "enum": [
            "CALL",
            "PUT"
          ]
        },
        "quote_received_at": {
          "type": [
            "string",
            "null"
          ]
        },
        "quote_updated_at": {
          "type": [
            "string",
            "null"
          ]
        },
        "strike": {
          "$ref": "#/$defs/nullableNumber"
        },
        "underlying": {
          "type": "string"
        },
        "volume": {
          "minimum": 0,
          "type": [
            "integer",
            "null"
          ]
        }
      },
      "required": [
        "underlying",
        "option_type",
        "strike",
        "expiration",
        "bid",
        "ask",
        "delta",
        "quote_updated_at",
        "quote_received_at",
        "volume",
        "open_interest",
        "earnings_date",
        "instrument_id"
      ],
      "type": "object"
    },
    "received_at": {
      "type": "string"
    },
    "sample_id": {
      "minLength": 1,
      "type": "string"
    },
    "schema_version": {
      "const": 1
    },
    "source_updated_at": {
      "type": "string"
    },
    "underlying": {
      "additionalProperties": false,
      "properties": {
        "average_volume": {
          "$ref": "#/$defs/nullableNumber"
        },
        "breakdown_low": {
          "$ref": "#/$defs/nullableNumber"
        },
        "breakout_high": {
          "$ref": "#/$defs/nullableNumber"
        },
        "close": {
          "$ref": "#/$defs/nullableNumber"
        },
        "current_volume": {
          "minimum": 0,
          "type": [
            "integer",
            "null"
          ]
        },
        "ema_fast": {
          "$ref": "#/$defs/nullableNumber"
        },
        "ema_slow": {
          "$ref": "#/$defs/nullableNumber"
        },
        "symbol": {
          "type": "string"
        },
        "vwap": {
          "$ref": "#/$defs/nullableNumber"
        }
      },
      "required": [
        "symbol",
        "close",
        "vwap",
        "ema_fast",
        "ema_slow",
        "breakout_high",
        "breakdown_low",
        "current_volume",
        "average_volume"
      ],
      "type": "object"
    }
  },
  "required": [
    "schema_version",
    "sample_id",
    "received_at",
    "source_updated_at",
    "completed_live_trades",
    "market",
    "account",
    "market_bars",
    "underlying",
    "option"
  ],
  "type": "object"
}
