{
  "account": {
    "account_type": "cash",
    "buying_power": "300",
    "consecutive_losses": 0,
    "entries_today": 0,
    "equity": "300",
    "equity_position_count": 0,
    "open_equity_order_count": 0,
    "open_option_order_count": 0,
    "option_position_count": 0,
    "reserved_cash": "0",
    "settled_cash": "300",
    "unsettled_cash": "0"
  },
  "completed_live_trades": 0,
  "market": {
    "market_open": true,
    "near_forced_exit": false,
    "within_entry_window": true
  },
  "market_bars": [
    {
      "close": "101",
      "completed": true,
      "ema_fast": "101",
      "ema_slow": "100",
      "ended_at": "2026-07-17T14:50:00Z",
      "interval_minutes": 5,
      "received_at": "2026-07-17T14:50:02Z",
      "source_updated_at": "2026-07-17T14:50:01Z",
      "started_at": "2026-07-17T14:45:00Z",
      "symbol": "SPY",
      "vwap": "100"
    },
    {
      "close": "102",
      "completed": true,
      "ema_fast": "101",
      "ema_slow": "100",
      "ended_at": "2026-07-17T14:55:00Z",
      "interval_minutes": 5,
      "received_at": "2026-07-17T14:55:02Z",
      "source_updated_at": "2026-07-17T14:55:01Z",
      "started_at": "2026-07-17T14:50:00Z",
      "symbol": "SPY",
      "vwap": "100"
    },
    {
      "close": "201",
      "completed": true,
      "ema_fast": "201",
      "ema_slow": "200",
      "ended_at": "2026-07-17T14:50:00Z",
      "interval_minutes": 5,
      "received_at": "2026-07-17T14:50:02Z",
      "source_updated_at": "2026-07-17T14:50:01Z",
      "started_at": "2026-07-17T14:45:00Z",
      "symbol": "QQQ",
      "vwap": "200"
    },
    {
      "close": "202",
      "completed": true,
      "ema_fast": "201",
      "ema_slow": "200",
      "ended_at": "2026-07-17T14:55:00Z",
      "interval_minutes": 5,
      "received_at": "2026-07-17T14:55:02Z",
      "source_updated_at": "2026-07-17T14:55:01Z",
      "started_at": "2026-07-17T14:50:00Z",
      "symbol": "QQQ",
      "vwap": "200"
    }
  ],
  "option": {
    "ask": "0.48",
    "bid": "0.47",
    "delta": "0.47",
    "earnings_date": "2026-07-29",
    "expiration": "2026-07-24",
    "instrument_id": "e3345530-8e0e-42f2-b2ff-cf5cac20d675",
    "open_interest": 5300,
    "option_type": "CALL",
    "quote_received_at": "2026-07-17T15:00:00Z",
    "quote_updated_at": "2026-07-17T14:59:59Z",
    "strike": "17.5",
    "underlying": "SOFI",
    "volume": 6500
  },
  "received_at": "2026-07-17T15:00:00Z",
  "sample_id": "example-2026-07-17T15:00:00Z",
  "schema_version": 1,
  "source_updated_at": "2026-07-17T14:59:59Z",
  "underlying": {
    "average_volume": "1000",
    "breakdown_low": "17.00",
    "breakout_high": "17.55",
    "close": "17.60",
    "current_volume": 1800,
    "ema_fast": "17.50",
    "ema_slow": "17.35",
    "symbol": "SOFI",
    "vwap": "17.30"
  }
}
